{
  "record_schema_version": "1.0",
  "package_id": "normalized-task-07-fixture",
  "case_id": "SYNTHETIC-CASE",
  "caller_summaries": [
    {
      "caller": "VAMOS",
      "caller_version": "fixture-1.0",
      "analysis_source": "RAW_READS",
      "run_status": "UNSUPPORTED_FORMAT",
      "evidence_state": "UNSUPPORTED_FORMAT",
      "record_count": 0,
      "native_output_count": 1,
      "associated_sequence_ids": [],
      "warnings": [
        "Synthetic fixture only."
      ],
      "failure": null
    }
  ],
  "comparison_availability": [],
  "note": "Inventory only; shared fields do not establish equivalent measurements."
}
